{
  "schema_version": "0.3.0",
  "package_id": "PKG-HO-AIR-QUANTITY-001",
  "package_title": "Synthetic Instrument Air Module Release Package",
  "created_date": "2026-07-16",
  "synthetic": true,
  "source_inventory": [
    {
      "source_type": "package_manifest",
      "path": "package_manifest.json",
      "format": "json",
      "required_for_release": true
    },
    {
      "source_type": "drawing_register",
      "path": "inputs/drawing_register.csv",
      "format": "csv",
      "required_for_release": true
    },
    {
      "source_type": "drawing_metadata",
      "path": "inputs/drawing_metadata.json",
      "format": "json",
      "required_for_release": true
    },
    {
      "source_type": "bom_or_equipment_list",
      "path": "inputs/bom_or_equipment_list.csv",
      "format": "csv",
      "required_for_release": true
    },
    {
      "source_type": "datasheet_spec_metadata",
      "path": "inputs/datasheet_spec_metadata.json",
      "format": "json",
      "required_for_release": true
    },
    {
      "source_type": "revision_history",
      "path": "inputs/revision_history.csv",
      "format": "csv",
      "required_for_release": true
    },
    {
      "source_type": "authority_map",
      "path": "authority/authority_map.json",
      "format": "json",
      "required_for_release": true
    }
  ],
  "authority_map_ref": "authority/authority_map.json",
  "allowed_file_reference_roots": [
    "files"
  ],
  "document_inventory": [
    {
      "document_id": "DOC-AIR-DWG-001",
      "document_type": "drawing",
      "drawing_number": "AIR-MOD-2100",
      "title": "Instrument Air Module General Arrangement",
      "required_for_release": true,
      "current_revision": {
        "revision_id": "03",
        "scheme": "numeric_zero_padded",
        "width": 2
      },
      "file_ref_id": "FILE-AIR-DWG-001"
    },
    {
      "document_id": "DOC-AIR-DWG-002",
      "document_type": "drawing",
      "drawing_number": "AIR-MOD-2200",
      "title": "Instrument Air Process and Instrumentation Diagram",
      "required_for_release": true,
      "current_revision": {
        "revision_id": "05",
        "scheme": "numeric_zero_padded",
        "width": 2
      },
      "file_ref_id": "FILE-AIR-DWG-002"
    },
    {
      "document_id": "DOC-AIR-DWG-003",
      "document_type": "drawing",
      "drawing_number": "AIR-MOD-2300",
      "title": "Receiver and Dryer Connection Layout",
      "required_for_release": true,
      "current_revision": {
        "revision_id": "02",
        "scheme": "numeric_zero_padded",
        "width": 2
      },
      "file_ref_id": "FILE-AIR-DWG-003"
    },
    {
      "document_id": "DOC-AIR-DS-001",
      "document_type": "datasheet",
      "datasheet_id": "DS-AIR-C210",
      "title": "Air Compressor C-210A Datasheet",
      "required_for_release": true,
      "current_revision": {
        "revision_id": "C0",
        "scheme": "explicit_sequence",
        "allowed_values": [
          "P0",
          "P1",
          "C0"
        ]
      },
      "file_ref_id": "FILE-AIR-DS-001"
    },
    {
      "document_id": "DOC-AIR-DS-002",
      "document_type": "datasheet",
      "datasheet_id": "DS-AIR-V220",
      "title": "Air Receiver V-220A Datasheet",
      "required_for_release": true,
      "current_revision": {
        "revision_id": "C0",
        "scheme": "explicit_sequence",
        "allowed_values": [
          "P0",
          "P1",
          "C0"
        ]
      },
      "file_ref_id": "FILE-AIR-DS-002"
    },
    {
      "document_id": "DOC-AIR-DS-003",
      "document_type": "datasheet",
      "datasheet_id": "DS-AIR-DR230",
      "title": "Desiccant Dryer DR-230A Datasheet",
      "required_for_release": true,
      "current_revision": {
        "revision_id": "C0",
        "scheme": "explicit_sequence",
        "allowed_values": [
          "P0",
          "P1",
          "C0"
        ]
      },
      "file_ref_id": "FILE-AIR-DS-003"
    },
    {
      "document_id": "DOC-AIR-SPEC-001",
      "document_type": "specification",
      "specification_id": "SPEC-AIR-SYS-010",
      "title": "Instrument Air Package Requirements",
      "required_for_release": true,
      "current_revision": {
        "revision_id": "C0",
        "scheme": "explicit_sequence",
        "allowed_values": [
          "P0",
          "P1",
          "C0"
        ]
      },
      "file_ref_id": "FILE-AIR-SPEC-001"
    },
    {
      "document_id": "DOC-AIR-SPEC-002",
      "document_type": "specification",
      "specification_id": "SPEC-AIR-VES-020",
      "title": "Air Receiver Minimum Requirements",
      "required_for_release": true,
      "current_revision": {
        "revision_id": "C0",
        "scheme": "explicit_sequence",
        "allowed_values": [
          "P0",
          "P1",
          "C0"
        ]
      },
      "file_ref_id": "FILE-AIR-SPEC-002"
    },
    {
      "document_id": "DOC-AIR-REG-001",
      "document_type": "register",
      "title": "Instrument Air Drawing Index",
      "required_for_release": true,
      "current_revision": {
        "revision_id": "2",
        "scheme": "numeric_integer"
      },
      "file_ref_id": "FILE-AIR-REG-001"
    },
    {
      "document_id": "DOC-AIR-EQL-001",
      "document_type": "equipment_list",
      "title": "Instrument Air Equipment Schedule",
      "required_for_release": true,
      "current_revision": {
        "revision_id": "2",
        "scheme": "numeric_integer"
      },
      "file_ref_id": "FILE-AIR-EQL-001"
    },
    {
      "document_id": "DOC-AIR-REV-001",
      "document_type": "revision_record",
      "title": "Instrument Air Revision Ledger",
      "required_for_release": true,
      "current_revision": {
        "revision_id": "2",
        "scheme": "numeric_integer"
      },
      "file_ref_id": "FILE-AIR-REV-001"
    }
  ],
  "file_references": [
    {
      "file_ref_id": "FILE-AIR-DWG-001",
      "path": "files/issued_drawings/AIR-MOD-2100_GA__r03.ref",
      "artifact_type": "drawing_reference",
      "required_for_release": true
    },
    {
      "file_ref_id": "FILE-AIR-DWG-002",
      "path": "files/issued_drawings/AIR-MOD-2200_PID__r05.ref",
      "artifact_type": "drawing_reference",
      "required_for_release": true
    },
    {
      "file_ref_id": "FILE-AIR-DWG-003",
      "path": "files/issued_drawings/AIR-MOD-2300_CONNECTION__r02.ref",
      "artifact_type": "drawing_reference",
      "required_for_release": true
    },
    {
      "file_ref_id": "FILE-AIR-DS-001",
      "path": "files/technical_schedules/C-210A__C0.ref",
      "artifact_type": "datasheet_reference",
      "required_for_release": true
    },
    {
      "file_ref_id": "FILE-AIR-DS-002",
      "path": "files/technical_schedules/V-220A__C0.ref",
      "artifact_type": "datasheet_reference",
      "required_for_release": true
    },
    {
      "file_ref_id": "FILE-AIR-DS-003",
      "path": "files/technical_schedules/DR-230A__C0.ref",
      "artifact_type": "datasheet_reference",
      "required_for_release": true
    },
    {
      "file_ref_id": "FILE-AIR-SPEC-001",
      "path": "files/design_requirements/AIR-SYSTEM-010__C0.ref",
      "artifact_type": "specification_reference",
      "required_for_release": true
    },
    {
      "file_ref_id": "FILE-AIR-SPEC-002",
      "path": "files/design_requirements/AIR-VESSEL-020__C0.ref",
      "artifact_type": "specification_reference",
      "required_for_release": true
    },
    {
      "file_ref_id": "FILE-AIR-REG-001",
      "path": "files/package_controls/drawing_index__r2.ref",
      "artifact_type": "register_reference",
      "required_for_release": true
    },
    {
      "file_ref_id": "FILE-AIR-EQL-001",
      "path": "files/package_controls/equipment_schedule__r2.ref",
      "artifact_type": "equipment_list_reference",
      "required_for_release": true
    },
    {
      "file_ref_id": "FILE-AIR-REV-001",
      "path": "files/package_controls/revision_ledger__r2.ref",
      "artifact_type": "revision_record_reference",
      "required_for_release": true
    }
  ],
  "relationship_declarations": [
    {
      "relationship_id": "REL-AIR-DOC-FILE-001",
      "relationship_type": "document_to_file",
      "source": {
        "identifier_type": "document_id",
        "identifier": "DOC-AIR-DWG-001"
      },
      "target": {
        "identifier_type": "file_ref_id",
        "identifier": "FILE-AIR-DWG-001"
      },
      "required_for_release": true
    },
    {
      "relationship_id": "REL-AIR-DOC-FILE-002",
      "relationship_type": "document_to_file",
      "source": {
        "identifier_type": "document_id",
        "identifier": "DOC-AIR-DWG-002"
      },
      "target": {
        "identifier_type": "file_ref_id",
        "identifier": "FILE-AIR-DWG-002"
      },
      "required_for_release": true
    },
    {
      "relationship_id": "REL-AIR-DOC-FILE-003",
      "relationship_type": "document_to_file",
      "source": {
        "identifier_type": "document_id",
        "identifier": "DOC-AIR-DWG-003"
      },
      "target": {
        "identifier_type": "file_ref_id",
        "identifier": "FILE-AIR-DWG-003"
      },
      "required_for_release": true
    },
    {
      "relationship_id": "REL-AIR-DOC-FILE-004",
      "relationship_type": "document_to_file",
      "source": {
        "identifier_type": "document_id",
        "identifier": "DOC-AIR-DS-001"
      },
      "target": {
        "identifier_type": "file_ref_id",
        "identifier": "FILE-AIR-DS-001"
      },
      "required_for_release": true
    },
    {
      "relationship_id": "REL-AIR-DOC-FILE-005",
      "relationship_type": "document_to_file",
      "source": {
        "identifier_type": "document_id",
        "identifier": "DOC-AIR-DS-002"
      },
      "target": {
        "identifier_type": "file_ref_id",
        "identifier": "FILE-AIR-DS-002"
      },
      "required_for_release": true
    },
    {
      "relationship_id": "REL-AIR-DOC-FILE-006",